{
  "schemaVersion": 1,
  "id": "walk_left",
  "name": "向左散步",
  "description": "侧身朝左迈步，手臂和鲸尾轻摆；走完恢复正面。",
  "tags": [
    "散步"
  ],
  "enabled": true,
  "random": {
    "eligible": true,
    "weight": 1,
    "cooldownMs": 12000
  },
  "conditions": {
    "minIdleMs": 5000,
    "requiresRoaming": true,
    "requiresPointerAway": true
  },
  "maxDurationMs": 2900,
  "timeline": {
    "type": "parallel",
    "children": [
      {
        "type": "motion",
        "motionId": "builtin.deepblue:walk_left",
        "repeat": 3
      },
      {
        "type": "move_by",
        "dxDip": -120,
        "dyDip": 0,
        "durationMs": 2400,
        "easing": "linear"
      }
    ]
  }
}
