{
  "schemaVersion": 1,
  "id": "sleep_short",
  "name": "盖被子睡觉",
  "description": "仅从站立待机进入盖被侧卧；嘴巴缓慢张合（最小面积为最大时的三分之一）、独立鲸尾轻摆，Z 从头部上方向右上飘，14.4 秒后恢复站立。",
  "tags": [
    "日常",
    "待机",
    "睡觉"
  ],
  "enabled": true,
  "random": {
    "eligible": true,
    "weight": 1,
    "cooldownMs": 60000
  },
  "conditions": {
    "minIdleMs": 8000,
    "requiresRoaming": false,
    "requiresPointerAway": true,
    "requiresStanding": true
  },
  "maxDurationMs": 15000,
  "timeline": {
    "type": "parallel",
    "children": [
      {
        "type": "motion",
        "motionId": "builtin.deepblue:sleep",
        "repeat": 4
      },
      {
        "type": "effect",
        "effectId": "sleepy",
        "durationMs": 14400,
        "origin": {
          "x": -71.68,
          "y": -246.4
        }
      }
    ]
  }
}
