{
  "schemaVersion": 1,
  "id": "playful_wink",
  "name": "俏皮眨单眼",
  "description": "闭起一只笑眼，配合笑嘴和轻轻歪头。",
  "tags": [
    "表情",
    "互动"
  ],
  "enabled": true,
  "random": {
    "eligible": true,
    "weight": 2,
    "cooldownMs": 30000
  },
  "conditions": {
    "minIdleMs": 4000,
    "requiresRoaming": false,
    "requiresPointerAway": true
  },
  "maxDurationMs": 2100,
  "timeline": {
    "type": "parallel",
    "children": [
      {
        "type": "motion",
        "motionId": "builtin.deepblue:playful_wink",
        "repeat": 1
      },
      {
        "type": "expression",
        "expressionId": "wink",
        "durationMs": 1600
      }
    ]
  }
}
