{
  "schemaVersion": 1,
  "id": "play_phone_surprised",
  "name": "玩手机惊讶",
  "description": "睁大眼睛、张开小圆嘴。独立表情版本，保留手机、手指、坐姿与尾巴动画；24fps，4 秒后回到站立。",
  "tags": [
    "手机",
    "惊讶",
    "坐姿"
  ],
  "enabled": true,
  "random": {
    "eligible": false,
    "weight": 1,
    "cooldownMs": 90000
  },
  "conditions": {
    "minIdleMs": 5000,
    "requiresRoaming": false,
    "requiresPointerAway": true,
    "requiresStanding": true,
    "requiresSoftwareOperation": true
  },
  "maxDurationMs": 4500,
  "timeline": {
    "type": "motion",
    "motionId": "builtin.deepblue:play_phone_surprised",
    "repeat": 1
  }
}
