{
  "schemaVersion": 1,
  "id": "play_phone_super_shy",
  "name": "玩手机超级害羞",
  "description": "整张脸渐渐泛红，双眼闭起、嘴巴微张，结束时恢复。独立表情版本，保留手机、手指、坐姿与尾巴动画；24fps，4 秒后回到站立。",
  "tags": [
    "手机",
    "超级害羞",
    "坐姿"
  ],
  "enabled": true,
  "random": {
    "eligible": false,
    "weight": 1,
    "cooldownMs": 90000
  },
  "conditions": {
    "minIdleMs": 5000,
    "requiresRoaming": false,
    "requiresPointerAway": true,
    "requiresStanding": true,
    "requiresSoftwareOperation": true
  },
  "maxDurationMs": 4500,
  "timeline": {
    "type": "motion",
    "motionId": "builtin.deepblue:play_phone_super_shy",
    "repeat": 1
  }
}
